Q: What is Amazon DynamoDB?,
Q: What does DynamoDB manage on my behalf?,
Q: What is the consistency model of DynamoDB?,
Q: What kind of query functionality does DynamoDB support?,
Q: How do I update and query data items with DynamoDB?,
Q: Can DynamoDB be used by applications running on any operating system?,
Q: How am I charged for my use of DynamoDB?,
Q: What is the maximum throughput I can provision for a single DynamoDB table?,
Q: What is the minimum throughput I can provision for a single DynamoDB table?,
Q:  Data models and APIs,
"Q: Scalability, availability, and durability",
Q: Auto scaling,
Q: Security and control,
